{
  "report_id": "rep_post_e2e_stm32_dma",
  "period_start": "2026-09-12T13:13:24.814321+00:00",
  "period_end": "2026-09-12T13:13:24.814326+00:00",
  "total_posts_published": 1,
  "total_impressions": 1840,
  "quality_engagement_ratio": 1.47,
  "inbound_technical_leads": 2,
  "top_performing_pillar": "pillar_embedded_firmware",
  "key_learnings": [
    "DMA memory domain partitioning posts generate outsized engagement from staff firmware engineers."
  ]
}